{
  "ncp_version": "1.0",
  "kind": "sensor_frame",
  "t": 1.0,
  "frame_id": "world",
  "channels": {
    "pose_error": {
      "data": [
        0.0,
        0.0,
        0.0
      ],
      "unit": "m"
    }
  },
  "stream": {
    "epoch": "3ef6f0ad-8ee6-4c6a-9e3f-86dc9ce849a1",
    "seq": 7
  },
  "session": {
    "generation": "293279f3-d459-4bfd-aeeb-604799e96925"
  },
  "session_id": "vec-open-1"
}
